[INFO] Scanning for projects...
[INFO] 
[INFO] -------------------< com.invoices:invoices-monolith >-------------------
[INFO] Building invoices-monolith 1.0.0
[INFO]   from pom.xml
[INFO] --------------------------------[ jar ]---------------------------------
[INFO] 
[INFO] --- jacoco:0.8.11:prepare-agent (prepare-agent) @ invoices-monolith ---
[INFO] argLine set to -javaagent:/Users/Jefferson/.m2/repository/org/jacoco/org.jacoco.agent/0.8.11/org.jacoco.agent-0.8.11-runtime.jar=destfile=/Users/Jefferson/Documents/proyecto/invoices-back/invoices-monolith/target/jacoco.exec
[INFO] 
[INFO] --- resources:3.3.1:resources (default-resources) @ invoices-monolith ---
[INFO] Copying 22 resources from src/main/resources to target/classes
[INFO] 
[INFO] --- compiler:3.13.0:compile (default-compile) @ invoices-monolith ---
[INFO] Nothing to compile - all classes are up to date.
[INFO] 
[INFO] --- resources:3.3.1:testResources (default-testResources) @ invoices-monolith ---
[INFO] Copying 3 resources from src/test/resources to target/test-classes
[INFO] 
[INFO] --- compiler:3.13.0:testCompile (default-testCompile) @ invoices-monolith ---
[INFO] Nothing to compile - all classes are up to date.
[INFO] 
[INFO] --- surefire:3.2.5:test (default-test) @ invoices-monolith ---
[INFO] Using auto detected provider org.apache.maven.surefire.junitplatform.JUnitPlatformProvider
[INFO] 
[INFO] -------------------------------------------------------
[INFO]  T E S T S
[INFO] -------------------------------------------------------
[INFO] Running com.invoices.document.controller.DocumentControllerTest
Standard Commons Logging discovery in action with spring-jcl: please remove commons-logging.jar from classpath in order to avoid potential conflicts
22:57:53.578 [main] INFO org.springframework.test.context.support.AnnotationConfigContextLoaderUtils -- Could not detect default configuration classes for test class [com.invoices.document.controller.DocumentControllerTest]: DocumentControllerTest does not declare any static, non-private, non-final, nested classes annotated with @Configuration.
22:57:53.760 [main] INFO org.springframework.boot.test.context.SpringBootTestContextBootstrapper -- Found @SpringBootConfiguration com.invoices.InvoicesApplication for test class com.invoices.document.controller.DocumentControllerTest
[INFO] Running com.invoices.document.controller.DocumentControllerTest$UploadDocumentTests
22:57:53.802 [main] INFO org.springframework.test.context.support.AnnotationConfigContextLoaderUtils -- Could not detect default configuration classes for test class [com.invoices.document.controller.DocumentControllerTest$UploadDocumentTests]: UploadDocumentTests does not declare any static, non-private, non-final, nested classes annotated with @Configuration.
22:57:53.813 [main] INFO org.springframework.boot.test.context.SpringBootTestContextBootstrapper -- Found @SpringBootConfiguration com.invoices.InvoicesApplication for test class com.invoices.document.controller.DocumentControllerTest$UploadDocumentTests

  .   ____          _            __ _ _
 /\\ / ___'_ __ _ _(_)_ __  __ _ \ \ \ \
( ( )\___ | '_ | '_| | '_ \/ _` | \ \ \ \
 \\/  ___)| |_)| | | | | || (_| |  ) ) ) )
  '  |____| .__|_| |_|_| |_\__, | / / / /
 =========|_|==============|___/=/_/_/_/

 :: Spring Boot ::                (v3.4.4)

2025-11-25T22:57:54.306+01:00  INFO 76210 --- [invoices-monolith-test] [           main] c.i.d.controller.DocumentControllerTest  : Starting DocumentControllerTest using Java 21.0.6 with PID 76210 (started by Jefferson in /Users/Jefferson/Documents/proyecto/invoices-back/invoices-monolith)
2025-11-25T22:57:54.307+01:00  INFO 76210 --- [invoices-monolith-test] [           main] c.i.d.controller.DocumentControllerTest  : The following 1 profile is active: "test"
Mockito is currently self-attaching to enable the inline-mock-maker. This will no longer work in future releases of the JDK. Please add Mockito as an agent to your build what is described in Mockito's documentation: https://javadoc.io/doc/org.mockito/mockito-core/latest/org/mockito/Mockito.html#0.3
OpenJDK 64-Bit Server VM warning: Sharing is only supported for boot loader classes because bootstrap classpath has been appended
WARNING: A Java agent has been loaded dynamically (/Users/Jefferson/.m2/repository/net/bytebuddy/byte-buddy-agent/1.15.11/byte-buddy-agent-1.15.11.jar)
WARNING: If a serviceability tool is in use, please run with -XX:+EnableDynamicAgentLoading to hide this warning
WARNING: If a serviceability tool is not in use, please run with -Djdk.instrument.traceUsage for more information
WARNING: Dynamic loading of agents will be disallowed by default in a future release
2025-11-25T22:57:57.012+01:00  INFO 76210 --- [invoices-monolith-test] [           main] c.invoices.security.RateLimitingFilter   : Rate limiting filter initialized with limits: General=100/1 min, Auth=10/1 min
2025-11-25T22:57:57.043+01:00  INFO 76210 --- [invoices-monolith-test] [           main] o.s.b.t.m.w.SpringBootMockServletContext : Initializing Spring TestDispatcherServlet ''
2025-11-25T22:57:57.043+01:00  INFO 76210 --- [invoices-monolith-test] [           main] o.s.t.web.servlet.TestDispatcherServlet  : Initializing Servlet ''
2025-11-25T22:57:57.045+01:00  INFO 76210 --- [invoices-monolith-test] [           main] o.s.t.web.servlet.TestDispatcherServlet  : Completed initialization in 1 ms
2025-11-25T22:57:57.079+01:00  INFO 76210 --- [invoices-monolith-test] [           main] c.i.d.controller.DocumentControllerTest  : Started DocumentControllerTest in 3.216 seconds (process running for 4.461)
2025-11-25T22:57:57.237+01:00  INFO 76210 --- [invoices-monolith-test] [           main] c.i.d.p.controllers.DocumentController   : POST /api/documents - Uploading document: test.pdf, size: 12 bytes, contentType: application/pdf
2025-11-25T22:57:57.239+01:00  INFO 76210 --- [invoices-monolith-test] [           main] c.i.d.p.controllers.DocumentController   : Document uploaded successfully with ID: 1

MockHttpServletRequest:
      HTTP Method = POST
      Request URI = /api/documents
       Parameters = {invoiceId=[100], uploadedBy=[test-user]}
          Headers = [Content-Type:"multipart/form-data;charset=UTF-8"]
             Body = null
    Session Attrs = {}

Handler:
             Type = com.invoices.document.presentation.controllers.DocumentController
           Method = com.invoices.document.presentation.controllers.DocumentController#uploadDocument(MultipartFile, Long, String)

Async:
    Async started = false
     Async result = null

Resolved Exception:
             Type = null

ModelAndView:
        View name = null
             View = null
            Model = null

FlashMap:
       Attributes = null

MockHttpServletResponse:
           Status = 201
    Error message = null
          Headers = [X-Rate-Limit-Remaining:"99", X-Rate-Limit-Limit:"100", Content-Type:"application/json"]
     Content type = application/json
             Body = {"documentId":1,"filename":"test-document.pdf","downloadUrl":"/api/documents/1/download","uploadedAt":"2025-11-25T22:57:57.121259"}
    Forwarded URL = null
   Redirected URL = null
          Cookies = []
2025-11-25T22:57:57.409+01:00  INFO 76210 --- [invoices-monolith-test] [           main] c.i.d.p.controllers.DocumentController   : POST /api/documents - Uploading document: test.txt, size: 12 bytes, contentType: text/plain
2025-11-25T22:57:57.410+01:00 ERROR 76210 --- [invoices-monolith-test] [           main] c.i.d.p.controllers.DocumentController   : Unexpected error uploading document

com.invoices.document.exception.InvalidFileTypeException: text/plain
	at com.invoices.document.domain.usecases.UploadDocumentUseCase.execute(UploadDocumentUseCase.java:50) ~[classes/:na]
	at com.invoices.document.presentation.controllers.DocumentController.uploadDocument(DocumentController.java:78) ~[classes/:na]
	at java.base/jdk.internal.reflect.DirectMethodHandleAccessor.invoke(DirectMethodHandleAccessor.java:103) ~[na:na]
	at java.base/java.lang.reflect.Method.invoke(Method.java:580) ~[na:na]
	at org.springframework.web.method.support.InvocableHandlerMethod.doInvoke(InvocableHandlerMethod.java:258) ~[spring-web-6.2.5.jar:6.2.5]
	at org.springframework.web.method.support.InvocableHandlerMethod.invokeForRequest(InvocableHandlerMethod.java:191) ~[spring-web-6.2.5.jar:6.2.5]
	at org.springframework.web.servlet.mvc.method.annotation.ServletInvocableHandlerMethod.invokeAndHandle(ServletInvocableHandlerMethod.java:118) ~[spring-webmvc-6.2.5.jar:6.2.5]
	at org.springframework.web.servlet.mvc.method.annotation.RequestMappingHandlerAdapter.invokeHandlerMethod(RequestMappingHandlerAdapter.java:986) ~[spring-webmvc-6.2.5.jar:6.2.5]
	at org.springframework.web.servlet.mvc.method.annotation.RequestMappingHandlerAdapter.handleInternal(RequestMappingHandlerAdapter.java:891) ~[spring-webmvc-6.2.5.jar:6.2.5]
	at org.springframework.web.servlet.mvc.method.AbstractHandlerMethodAdapter.handle(AbstractHandlerMethodAdapter.java:87) ~[spring-webmvc-6.2.5.jar:6.2.5]
	at org.springframework.web.servlet.DispatcherServlet.doDispatch(DispatcherServlet.java:1089) ~[spring-webmvc-6.2.5.jar:6.2.5]
	at org.springframework.web.servlet.DispatcherServlet.doService(DispatcherServlet.java:979) ~[spring-webmvc-6.2.5.jar:6.2.5]
	at org.springframework.web.servlet.FrameworkServlet.processRequest(FrameworkServlet.java:1014) ~[spring-webmvc-6.2.5.jar:6.2.5]
	at org.springframework.web.servlet.FrameworkServlet.doPost(FrameworkServlet.java:914) ~[spring-webmvc-6.2.5.jar:6.2.5]
	at jakarta.servlet.http.HttpServlet.service(HttpServlet.java:590) ~[tomcat-embed-core-10.1.39.jar:6.0]
	at org.springframework.web.servlet.FrameworkServlet.service(FrameworkServlet.java:885) ~[spring-webmvc-6.2.5.jar:6.2.5]
	at org.springframework.test.web.servlet.TestDispatcherServlet.service(TestDispatcherServlet.java:72) ~[spring-test-6.2.5.jar:6.2.5]
	at jakarta.servlet.http.HttpServlet.service(HttpServlet.java:658) ~[tomcat-embed-core-10.1.39.jar:6.0]
	at org.springframework.mock.web.MockFilterChain$ServletFilterProxy.doFilter(MockFilterChain.java:165) ~[spring-test-6.2.5.jar:6.2.5]
	at org.springframework.mock.web.MockFilterChain.doFilter(MockFilterChain.java:132) ~[spring-test-6.2.5.jar:6.2.5]
	at com.invoices.document.controller.DocumentControllerTest.lambda$0(DocumentControllerTest.java:129) ~[test-classes/:na]
	at org.springframework.web.filter.OncePerRequestFilter.doFilter(OncePerRequestFilter.java:92) ~[spring-web-6.2.5.jar:6.2.5]
	at org.springframework.test.web.servlet.setup.MockMvcFilterDecorator.doFilter(MockMvcFilterDecorator.java:162) ~[spring-test-6.2.5.jar:6.2.5]
	at org.springframework.mock.web.MockFilterChain.doFilter(MockFilterChain.java:132) ~[spring-test-6.2.5.jar:6.2.5]
	at org.springframework.web.servlet.resource.ResourceUrlEncodingFilter.doFilter(ResourceUrlEncodingFilter.java:66) ~[spring-webmvc-6.2.5.jar:6.2.5]
	at org.springframework.test.web.servlet.setup.MockMvcFilterDecorator.doFilter(MockMvcFilterDecorator.java:162) ~[spring-test-6.2.5.jar:6.2.5]
	at org.springframework.mock.web.MockFilterChain.doFilter(MockFilterChain.java:132) ~[spring-test-6.2.5.jar:6.2.5]
	at com.invoices.security.RateLimitingFilter.doFilter(RateLimitingFilter.java:81) ~[classes/:na]
	at org.springframework.test.web.servlet.setup.MockMvcFilterDecorator.doFilter(MockMvcFilterDecorator.java:162) ~[spring-test-6.2.5.jar:6.2.5]
	at org.springframework.mock.web.MockFilterChain.doFilter(MockFilterChain.java:132) ~[spring-test-6.2.5.jar:6.2.5]
	at org.springframework.web.filter.RequestContextFilter.doFilterInternal(RequestContextFilter.java:100) ~[spring-web-6.2.5.jar:6.2.5]
	at org.springframework.web.filter.OncePerRequestFilter.doFilter(OncePerRequestFilter.java:116) ~[spring-web-6.2.5.jar:6.2.5]
	at org.springframework.test.web.servlet.setup.MockMvcFilterDecorator.doFilter(MockMvcFilterDecorator.java:162) ~[spring-test-6.2.5.jar:6.2.5]
	at org.springframework.mock.web.MockFilterChain.doFilter(MockFilterChain.java:132) ~[spring-test-6.2.5.jar:6.2.5]
	at org.springframework.web.filter.FormContentFilter.doFilterInternal(FormContentFilter.java:93) ~[spring-web-6.2.5.jar:6.2.5]
	at org.springframework.web.filter.OncePerRequestFilter.doFilter(OncePerRequestFilter.java:116) ~[spring-web-6.2.5.jar:6.2.5]
	at org.springframework.test.web.servlet.setup.MockMvcFilterDecorator.doFilter(MockMvcFilterDecorator.java:162) ~[spring-test-6.2.5.jar:6.2.5]
	at org.springframework.mock.web.MockFilterChain.doFilter(MockFilterChain.java:132) ~[spring-test-6.2.5.jar:6.2.5]
	at org.springframework.web.filter.CharacterEncodingFilter.doFilterInternal(CharacterEncodingFilter.java:201) ~[spring-web-6.2.5.jar:6.2.5]
	at org.springframework.web.filter.OncePerRequestFilter.doFilter(OncePerRequestFilter.java:116) ~[spring-web-6.2.5.jar:6.2.5]
	at org.springframework.test.web.servlet.setup.MockMvcFilterDecorator.doFilter(MockMvcFilterDecorator.java:162) ~[spring-test-6.2.5.jar:6.2.5]
	at org.springframework.mock.web.MockFilterChain.doFilter(MockFilterChain.java:132) ~[spring-test-6.2.5.jar:6.2.5]
	at org.springframework.test.web.servlet.MockMvc.perform(MockMvc.java:201) ~[spring-test-6.2.5.jar:6.2.5]
	at com.invoices.document.controller.DocumentControllerTest$UploadDocumentTests.shouldReturn400ForInvalidFileType(DocumentControllerTest.java:209) ~[test-classes/:na]
	at java.base/jdk.internal.reflect.DirectMethodHandleAccessor.invoke(DirectMethodHandleAccessor.java:103) ~[na:na]
	at java.base/java.lang.reflect.Method.invoke(Method.java:580) ~[na:na]
	at org.junit.platform.commons.util.ReflectionUtils.invokeMethod(ReflectionUtils.java:767) ~[junit-platform-commons-1.11.4.jar:1.11.4]
	at org.junit.jupiter.engine.execution.MethodInvocation.proceed(MethodInvocation.java:60) ~[junit-jupiter-engine-5.11.4.jar:5.11.4]
	at org.junit.jupiter.engine.execution.InvocationInterceptorChain$ValidatingInvocation.proceed(InvocationInterceptorChain.java:131) ~[junit-jupiter-engine-5.11.4.jar:5.11.4]
	at org.junit.jupiter.engine.extension.TimeoutExtension.intercept(TimeoutExtension.java:156) ~[junit-jupiter-engine-5.11.4.jar:5.11.4]
	at org.junit.jupiter.engine.extension.TimeoutExtension.interceptTestableMethod(TimeoutExtension.java:147) ~[junit-jupiter-engine-5.11.4.jar:5.11.4]
	at org.junit.jupiter.engine.extension.TimeoutExtension.interceptTestMethod(TimeoutExtension.java:86) ~[junit-jupiter-engine-5.11.4.jar:5.11.4]
	at org.junit.jupiter.engine.execution.InterceptingExecutableInvoker$ReflectiveInterceptorCall.lambda$ofVoidMethod$0(InterceptingExecutableInvoker.java:103) ~[junit-jupiter-engine-5.11.4.jar:5.11.4]
	at org.junit.jupiter.engine.execution.InterceptingExecutableInvoker.lambda$invoke$0(InterceptingExecutableInvoker.java:93) ~[junit-jupiter-engine-5.11.4.jar:5.11.4]
	at org.junit.jupiter.engine.execution.InvocationInterceptorChain$InterceptedInvocation.proceed(InvocationInterceptorChain.java:106) ~[junit-jupiter-engine-5.11.4.jar:5.11.4]
	at org.junit.jupiter.engine.execution.InvocationInterceptorChain.proceed(InvocationInterceptorChain.java:64) ~[junit-jupiter-engine-5.11.4.jar:5.11.4]
	at org.junit.jupiter.engine.execution.InvocationInterceptorChain.chainAndInvoke(InvocationInterceptorChain.java:45) ~[junit-jupiter-engine-5.11.4.jar:5.11.4]
	at org.junit.jupiter.engine.execution.InvocationInterceptorChain.invoke(InvocationInterceptorChain.java:37) ~[junit-jupiter-engine-5.11.4.jar:5.11.4]
	at org.junit.jupiter.engine.execution.InterceptingExecutableInvoker.invoke(InterceptingExecutableInvoker.java:92) ~[junit-jupiter-engine-5.11.4.jar:5.11.4]
	at org.junit.jupiter.engine.execution.InterceptingExecutableInvoker.invoke(InterceptingExecutableInvoker.java:86) ~[junit-jupiter-engine-5.11.4.jar:5.11.4]
	at org.junit.jupiter.engine.descriptor.TestMethodTestDescriptor.lambda$invokeTestMethod$8(TestMethodTestDescriptor.java:217) ~[junit-jupiter-engine-5.11.4.jar:5.11.4]
	at org.junit.platform.engine.support.hierarchical.ThrowableCollector.execute(ThrowableCollector.java:73) ~[junit-platform-engine-1.11.4.jar:1.11.4]
	at org.junit.jupiter.engine.descriptor.TestMethodTestDescriptor.invokeTestMethod(TestMethodTestDescriptor.java:213) ~[junit-jupiter-engine-5.11.4.jar:5.11.4]
	at org.junit.jupiter.engine.descriptor.TestMethodTestDescriptor.execute(TestMethodTestDescriptor.java:138) ~[junit-jupiter-engine-5.11.4.jar:5.11.4]
	at org.junit.jupiter.engine.descriptor.TestMethodTestDescriptor.execute(TestMethodTestDescriptor.java:68) ~[junit-jupiter-engine-5.11.4.jar:5.11.4]
	at org.junit.platform.engine.support.hierarchical.NodeTestTask.lambda$executeRecursively$6(NodeTestTask.java:156) ~[junit-platform-engine-1.11.4.jar:1.11.4]
	at org.junit.platform.engine.support.hierarchical.ThrowableCollector.execute(ThrowableCollector.java:73) ~[junit-platform-engine-1.11.4.jar:1.11.4]
	at org.junit.platform.engine.support.hierarchical.NodeTestTask.lambda$executeRecursively$8(NodeTestTask.java:146) ~[junit-platform-engine-1.11.4.jar:1.11.4]
	at org.junit.platform.engine.support.hierarchical.Node.around(Node.java:137) ~[junit-platform-engine-1.11.4.jar:1.11.4]
	at org.junit.platform.engine.support.hierarchical.NodeTestTask.lambda$executeRecursively$9(NodeTestTask.java:144) ~[junit-platform-engine-1.11.4.jar:1.11.4]
	at org.junit.platform.engine.support.hierarchical.ThrowableCollector.execute(ThrowableCollector.java:73) ~[junit-platform-engine-1.11.4.jar:1.11.4]
	at org.junit.platform.engine.support.hierarchical.NodeTestTask.executeRecursively(NodeTestTask.java:143) ~[junit-platform-engine-1.11.4.jar:1.11.4]
	at org.junit.platform.engine.support.hierarchical.NodeTestTask.execute(NodeTestTask.java:100) ~[junit-platform-engine-1.11.4.jar:1.11.4]
	at java.base/java.util.ArrayList.forEach(ArrayList.java:1596) ~[na:na]
	at org.junit.platform.engine.support.hierarchical.SameThreadHierarchicalTestExecutorService.invokeAll(SameThreadHierarchicalTestExecutorService.java:41) ~[junit-platform-engine-1.11.4.jar:1.11.4]
	at org.junit.platform.engine.support.hierarchical.NodeTestTask.lambda$executeRecursively$6(NodeTestTask.java:160) ~[junit-platform-engine-1.11.4.jar:1.11.4]
	at org.junit.platform.engine.support.hierarchical.ThrowableCollector.execute(ThrowableCollector.java:73) ~[junit-platform-engine-1.11.4.jar:1.11.4]
	at org.junit.platform.engine.support.hierarchical.NodeTestTask.lambda$executeRecursively$8(NodeTestTask.java:146) ~[junit-platform-engine-1.11.4.jar:1.11.4]
	at org.junit.platform.engine.support.hierarchical.Node.around(Node.java:137) ~[junit-platform-engine-1.11.4.jar:1.11.4]
	at org.junit.platform.engine.support.hierarchical.NodeTestTask.lambda$executeRecursively$9(NodeTestTask.java:144) ~[junit-platform-engine-1.11.4.jar:1.11.4]
	at org.junit.platform.engine.support.hierarchical.ThrowableCollector.execute(ThrowableCollector.java:73) ~[junit-platform-engine-1.11.4.jar:1.11.4]
	at org.junit.platform.engine.support.hierarchical.NodeTestTask.executeRecursively(NodeTestTask.java:143) ~[junit-platform-engine-1.11.4.jar:1.11.4]
	at org.junit.platform.engine.support.hierarchical.NodeTestTask.execute(NodeTestTask.java:100) ~[junit-platform-engine-1.11.4.jar:1.11.4]
	at java.base/java.util.ArrayList.forEach(ArrayList.java:1596) ~[na:na]
	at org.junit.platform.engine.support.hierarchical.SameThreadHierarchicalTestExecutorService.invokeAll(SameThreadHierarchicalTestExecutorService.java:41) ~[junit-platform-engine-1.11.4.jar:1.11.4]
	at org.junit.platform.engine.support.hierarchical.NodeTestTask.lambda$executeRecursively$6(NodeTestTask.java:160) ~[junit-platform-engine-1.11.4.jar:1.11.4]
	at org.junit.platform.engine.support.hierarchical.ThrowableCollector.execute(ThrowableCollector.java:73) ~[junit-platform-engine-1.11.4.jar:1.11.4]
	at org.junit.platform.engine.support.hierarchical.NodeTestTask.lambda$executeRecursively$8(NodeTestTask.java:146) ~[junit-platform-engine-1.11.4.jar:1.11.4]
	at org.junit.platform.engine.support.hierarchical.Node.around(Node.java:137) ~[junit-platform-engine-1.11.4.jar:1.11.4]
	at org.junit.platform.engine.support.hierarchical.NodeTestTask.lambda$executeRecursively$9(NodeTestTask.java:144) ~[junit-platform-engine-1.11.4.jar:1.11.4]
	at org.junit.platform.engine.support.hierarchical.ThrowableCollector.execute(ThrowableCollector.java:73) ~[junit-platform-engine-1.11.4.jar:1.11.4]
	at org.junit.platform.engine.support.hierarchical.NodeTestTask.executeRecursively(NodeTestTask.java:143) ~[junit-platform-engine-1.11.4.jar:1.11.4]
	at org.junit.platform.engine.support.hierarchical.NodeTestTask.execute(NodeTestTask.java:100) ~[junit-platform-engine-1.11.4.jar:1.11.4]
	at java.base/java.util.ArrayList.forEach(ArrayList.java:1596) ~[na:na]
	at org.junit.platform.engine.support.hierarchical.SameThreadHierarchicalTestExecutorService.invokeAll(SameThreadHierarchicalTestExecutorService.java:41) ~[junit-platform-engine-1.11.4.jar:1.11.4]
	at org.junit.platform.engine.support.hierarchical.NodeTestTask.lambda$executeRecursively$6(NodeTestTask.java:160) ~[junit-platform-engine-1.11.4.jar:1.11.4]
	at org.junit.platform.engine.support.hierarchical.ThrowableCollector.execute(ThrowableCollector.java:73) ~[junit-platform-engine-1.11.4.jar:1.11.4]
	at org.junit.platform.engine.support.hierarchical.NodeTestTask.lambda$executeRecursively$8(NodeTestTask.java:146) ~[junit-platform-engine-1.11.4.jar:1.11.4]
	at org.junit.platform.engine.support.hierarchical.Node.around(Node.java:137) ~[junit-platform-engine-1.11.4.jar:1.11.4]
	at org.junit.platform.engine.support.hierarchical.NodeTestTask.lambda$executeRecursively$9(NodeTestTask.java:144) ~[junit-platform-engine-1.11.4.jar:1.11.4]
	at org.junit.platform.engine.support.hierarchical.ThrowableCollector.execute(ThrowableCollector.java:73) ~[junit-platform-engine-1.11.4.jar:1.11.4]
	at org.junit.platform.engine.support.hierarchical.NodeTestTask.executeRecursively(NodeTestTask.java:143) ~[junit-platform-engine-1.11.4.jar:1.11.4]
	at org.junit.platform.engine.support.hierarchical.NodeTestTask.execute(NodeTestTask.java:100) ~[junit-platform-engine-1.11.4.jar:1.11.4]
	at org.junit.platform.engine.support.hierarchical.SameThreadHierarchicalTestExecutorService.submit(SameThreadHierarchicalTestExecutorService.java:35) ~[junit-platform-engine-1.11.4.jar:1.11.4]
	at org.junit.platform.engine.support.hierarchical.HierarchicalTestExecutor.execute(HierarchicalTestExecutor.java:57) ~[junit-platform-engine-1.11.4.jar:1.11.4]
	at org.junit.platform.engine.support.hierarchical.HierarchicalTestEngine.execute(HierarchicalTestEngine.java:54) ~[junit-platform-engine-1.11.4.jar:1.11.4]
	at org.junit.platform.launcher.core.EngineExecutionOrchestrator.execute(EngineExecutionOrchestrator.java:198) ~[junit-platform-launcher-1.11.4.jar:1.11.4]
	at org.junit.platform.launcher.core.EngineExecutionOrchestrator.execute(EngineExecutionOrchestrator.java:169) ~[junit-platform-launcher-1.11.4.jar:1.11.4]
	at org.junit.platform.launcher.core.EngineExecutionOrchestrator.execute(EngineExecutionOrchestrator.java:93) ~[junit-platform-launcher-1.11.4.jar:1.11.4]
	at org.junit.platform.launcher.core.EngineExecutionOrchestrator.lambda$execute$0(EngineExecutionOrchestrator.java:58) ~[junit-platform-launcher-1.11.4.jar:1.11.4]
	at org.junit.platform.launcher.core.EngineExecutionOrchestrator.withInterceptedStreams(EngineExecutionOrchestrator.java:141) ~[junit-platform-launcher-1.11.4.jar:1.11.4]
	at org.junit.platform.launcher.core.EngineExecutionOrchestrator.execute(EngineExecutionOrchestrator.java:57) ~[junit-platform-launcher-1.11.4.jar:1.11.4]
	at org.junit.platform.launcher.core.DefaultLauncher.execute(DefaultLauncher.java:103) ~[junit-platform-launcher-1.11.4.jar:1.11.4]
	at org.junit.platform.launcher.core.DefaultLauncher.execute(DefaultLauncher.java:85) ~[junit-platform-launcher-1.11.4.jar:1.11.4]
	at org.junit.platform.launcher.core.DelegatingLauncher.execute(DelegatingLauncher.java:47) ~[junit-platform-launcher-1.11.4.jar:1.11.4]
	at org.apache.maven.surefire.junitplatform.LazyLauncher.execute(LazyLauncher.java:56) ~[surefire-junit-platform-3.2.5.jar:3.2.5]
	at org.apache.maven.surefire.junitplatform.JUnitPlatformProvider.execute(JUnitPlatformProvider.java:184) ~[surefire-junit-platform-3.2.5.jar:3.2.5]
	at org.apache.maven.surefire.junitplatform.JUnitPlatformProvider.invokeAllTests(JUnitPlatformProvider.java:148) ~[surefire-junit-platform-3.2.5.jar:3.2.5]
	at org.apache.maven.surefire.junitplatform.JUnitPlatformProvider.invoke(JUnitPlatformProvider.java:122) ~[surefire-junit-platform-3.2.5.jar:3.2.5]
	at org.apache.maven.surefire.booter.ForkedBooter.runSuitesInProcess(ForkedBooter.java:385) ~[surefire-booter-3.2.5.jar:3.2.5]
	at org.apache.maven.surefire.booter.ForkedBooter.execute(ForkedBooter.java:162) ~[surefire-booter-3.2.5.jar:3.2.5]
	at org.apache.maven.surefire.booter.ForkedBooter.run(ForkedBooter.java:507) ~[surefire-booter-3.2.5.jar:3.2.5]
	at org.apache.maven.surefire.booter.ForkedBooter.main(ForkedBooter.java:495) ~[surefire-booter-3.2.5.jar:3.2.5]


MockHttpServletRequest:
      HTTP Method = POST
      Request URI = /api/documents
       Parameters = {}
          Headers = [Content-Type:"multipart/form-data;charset=UTF-8"]
             Body = null
    Session Attrs = {}

Handler:
             Type = com.invoices.document.presentation.controllers.DocumentController
           Method = com.invoices.document.presentation.controllers.DocumentController#uploadDocument(MultipartFile, Long, String)

Async:
    Async started = false
     Async result = null

Resolved Exception:
             Type = null

ModelAndView:
        View name = null
             View = null
            Model = null

FlashMap:
       Attributes = null

MockHttpServletResponse:
           Status = 500
    Error message = null
          Headers = [X-Rate-Limit-Remaining:"98", X-Rate-Limit-Limit:"100"]
     Content type = null
             Body = 
    Forwarded URL = null
   Redirected URL = null
          Cookies = []

MockHttpServletRequest:
      HTTP Method = POST
      Request URI = /api/documents
       Parameters = {}
          Headers = [Content-Type:"multipart/form-data;charset=UTF-8"]
             Body = null
    Session Attrs = {}

Handler:
             Type = com.invoices.document.presentation.controllers.DocumentController
           Method = com.invoices.document.presentation.controllers.DocumentController#uploadDocument(MultipartFile, Long, String)

Async:
    Async started = false
     Async result = null

Resolved Exception:
             Type = null

ModelAndView:
        View name = null
             View = null
            Model = null

FlashMap:
       Attributes = null

MockHttpServletResponse:
           Status = 500
    Error message = null
          Headers = [X-Rate-Limit-Remaining:"98", X-Rate-Limit-Limit:"100"]
     Content type = null
             Body = 
    Forwarded URL = null
   Redirected URL = null
          Cookies = []
2025-11-25T22:57:57.445+01:00  INFO 76210 --- [invoices-monolith-test] [           main] c.i.d.p.controllers.DocumentController   : POST /api/documents - Uploading document: test.pdf, size: 12 bytes, contentType: application/pdf
2025-11-25T22:57:57.446+01:00  INFO 76210 --- [invoices-monolith-test] [           main] c.i.d.p.controllers.DocumentController   : Document uploaded successfully with ID: 1

MockHttpServletRequest:
      HTTP Method = POST
      Request URI = /api/documents
       Parameters = {}
          Headers = [Content-Type:"multipart/form-data;charset=UTF-8"]
             Body = null
    Session Attrs = {}

Handler:
             Type = com.invoices.document.presentation.controllers.DocumentController
           Method = com.invoices.document.presentation.controllers.DocumentController#uploadDocument(MultipartFile, Long, String)

Async:
    Async started = false
     Async result = null

Resolved Exception:
             Type = null

ModelAndView:
        View name = null
             View = null
            Model = null

FlashMap:
       Attributes = null

MockHttpServletResponse:
           Status = 201
    Error message = null
          Headers = [X-Rate-Limit-Remaining:"97", X-Rate-Limit-Limit:"100", Content-Type:"application/json"]
     Content type = application/json
             Body = {"documentId":1,"filename":"test-document.pdf","downloadUrl":"/api/documents/1/download","uploadedAt":"2025-11-25T22:57:57.442933"}
    Forwarded URL = null
   Redirected URL = null
          Cookies = []
[ERROR] Tests run: 3, Failures: 1, Errors: 0, Skipped: 0, Time elapsed: 3.662 s <<< FAILURE! -- in com.invoices.document.controller.DocumentControllerTest$UploadDocumentTests
[ERROR] com.invoices.document.controller.DocumentControllerTest$UploadDocumentTests.shouldReturn400ForInvalidFileType -- Time elapsed: 0.032 s <<< FAILURE!
java.lang.AssertionError: Status expected:<400> but was:<500>
	at org.springframework.test.util.AssertionErrors.fail(AssertionErrors.java:61)
	at org.springframework.test.util.AssertionErrors.assertEquals(AssertionErrors.java:128)
	at org.springframework.test.web.servlet.result.StatusResultMatchers.lambda$matcher$9(StatusResultMatchers.java:640)
	at org.springframework.test.web.servlet.MockMvc$1.andExpect(MockMvc.java:214)
	at com.invoices.document.controller.DocumentControllerTest$UploadDocumentTests.shouldReturn400ForInvalidFileType(DocumentControllerTest.java:212)
	at java.base/java.lang.reflect.Method.invoke(Method.java:580)
	at java.base/java.util.ArrayList.forEach(ArrayList.java:1596)
	at java.base/java.util.ArrayList.forEach(ArrayList.java:1596)
	at java.base/java.util.ArrayList.forEach(ArrayList.java:1596)

[INFO] Tests run: 0, Failures: 0, Errors: 0, Skipped: 0, Time elapsed: 4.073 s -- in com.invoices.document.controller.DocumentControllerTest
[INFO] 
[INFO] Results:
[INFO] 
[ERROR] Failures: 
[ERROR]   DocumentControllerTest$UploadDocumentTests.shouldReturn400ForInvalidFileType:212 Status expected:<400> but was:<500>
[INFO] 
[ERROR] Tests run: 3, Failures: 1, Errors: 0, Skipped: 0
[INFO] 
[INFO] ------------------------------------------------------------------------
[INFO] BUILD FAILURE
[INFO] ------------------------------------------------------------------------
[INFO] Total time:  6.322 s
[INFO] Finished at: 2025-11-25T22:57:57+01:00
[INFO] ------------------------------------------------------------------------
[ERROR] Failed to execute goal org.apache.maven.plugins:maven-surefire-plugin:3.2.5:test (default-test) on project invoices-monolith: There are test failures.
[ERROR] 
[ERROR] Please refer to /Users/Jefferson/Documents/proyecto/invoices-back/invoices-monolith/target/surefire-reports for the individual test results.
[ERROR] Please refer to dump files (if any exist) [date].dump, [date]-jvmRun[N].dump and [date].dumpstream.
[ERROR] -> [Help 1]
[ERROR] 
[ERROR] To see the full stack trace of the errors, re-run Maven with the -e switch.
[ERROR] Re-run Maven using the -X switch to enable full debug logging.
[ERROR] 
[ERROR] For more information about the errors and possible solutions, please read the following articles:
[ERROR] [Help 1] http://cwiki.apache.org/confluence/display/MAVEN/MojoFailureException
