[INFO] Scanning for projects...
[INFO] 
[INFO] -------------------< com.invoices:invoices-monolith >-------------------
[INFO] Building invoices-monolith 1.0.0
[INFO]   from pom.xml
[INFO] --------------------------------[ jar ]---------------------------------
[INFO] 
[INFO] --- jacoco:0.8.11:prepare-agent (prepare-agent) @ invoices-monolith ---
[INFO] argLine set to -javaagent:/Users/Jefferson/.m2/repository/org/jacoco/org.jacoco.agent/0.8.11/org.jacoco.agent-0.8.11-runtime.jar=destfile=/Users/Jefferson/Documents/proyecto/invoices-back/invoices-monolith/target/jacoco.exec
[INFO] 
[INFO] --- resources:3.3.1:resources (default-resources) @ invoices-monolith ---
[INFO] Copying 25 resources from src/main/resources to target/classes
[INFO] 
[INFO] --- compiler:3.13.0:compile (default-compile) @ invoices-monolith ---
[INFO] Nothing to compile - all classes are up to date.
[INFO] 
[INFO] --- resources:3.3.1:testResources (default-testResources) @ invoices-monolith ---
[INFO] Copying 3 resources from src/test/resources to target/test-classes
[INFO] 
[INFO] --- compiler:3.13.0:testCompile (default-testCompile) @ invoices-monolith ---
[INFO] Nothing to compile - all classes are up to date.
[INFO] 
[INFO] --- surefire:3.2.5:test (default-test) @ invoices-monolith ---
[INFO] Using auto detected provider org.apache.maven.surefire.junitplatform.JUnitPlatformProvider
[INFO] 
[INFO] -------------------------------------------------------
[INFO]  T E S T S
[INFO] -------------------------------------------------------
[INFO] Running com.invoices.invoice.infrastructure.messaging.RedisEventListenerIT
Standard Commons Logging discovery in action with spring-jcl: please remove commons-logging.jar from classpath in order to avoid potential conflicts
23:54:19.547 [main] INFO org.springframework.test.context.support.AnnotationConfigContextLoaderUtils -- Could not detect default configuration classes for test class [com.invoices.invoice.infrastructure.messaging.RedisEventListenerIT]: RedisEventListenerIT does not declare any static, non-private, non-final, nested classes annotated with @Configuration.
23:54:19.725 [main] INFO org.springframework.boot.test.context.SpringBootTestContextBootstrapper -- Found @SpringBootConfiguration com.invoices.InvoicesApplication for test class com.invoices.invoice.infrastructure.messaging.RedisEventListenerIT

  .   ____          _            __ _ _
 /\\ / ___'_ __ _ _(_)_ __  __ _ \ \ \ \
( ( )\___ | '_ | '_| | '_ \/ _` | \ \ \ \
 \\/  ___)| |_)| | | | | || (_| |  ) ) ) )
  '  |____| .__|_| |_|_| |_\__, | / / / /
 =========|_|==============|___/=/_/_/_/

 :: Spring Boot ::                (v3.4.4)

2025-11-26T23:54:20.289+01:00  INFO 2986 --- [invoices-monolith-test] [           main] c.i.i.i.messaging.RedisEventListenerIT   : Starting RedisEventListenerIT using Java 21.0.6 with PID 2986 (started by Jefferson in /Users/Jefferson/Documents/proyecto/invoices-back/invoices-monolith)
2025-11-26T23:54:20.290+01:00  INFO 2986 --- [invoices-monolith-test] [           main] c.i.i.i.messaging.RedisEventListenerIT   : The following 1 profile is active: "test"
2025-11-26T23:54:21.716+01:00  INFO 2986 --- [invoices-monolith-test] [           main] .s.d.r.c.RepositoryConfigurationDelegate : Multiple Spring Data modules found, entering strict repository configuration mode
2025-11-26T23:54:21.718+01:00  INFO 2986 --- [invoices-monolith-test] [           main] .s.d.r.c.RepositoryConfigurationDelegate : Bootstrapping Spring Data JPA repositories in DEFAULT mode.
2025-11-26T23:54:21.886+01:00  INFO 2986 --- [invoices-monolith-test] [           main] .s.d.r.c.RepositoryConfigurationDelegate : Finished Spring Data repository scanning in 159 ms. Found 9 JPA repository interfaces.
2025-11-26T23:54:23.085+01:00  INFO 2986 --- [invoices-monolith-test] [           main] o.s.b.w.embedded.tomcat.TomcatWebServer  : Tomcat initialized with port 8080 (http)
2025-11-26T23:54:23.101+01:00  INFO 2986 --- [invoices-monolith-test] [           main] o.apache.catalina.core.StandardService   : Starting service [Tomcat]
2025-11-26T23:54:23.101+01:00  INFO 2986 --- [invoices-monolith-test] [           main] o.apache.catalina.core.StandardEngine    : Starting Servlet engine: [Apache Tomcat/10.1.39]
2025-11-26T23:54:23.151+01:00  INFO 2986 --- [invoices-monolith-test] [           main] o.a.c.c.C.[Tomcat].[localhost].[/]       : Initializing Spring embedded WebApplicationContext
2025-11-26T23:54:23.152+01:00  INFO 2986 --- [invoices-monolith-test] [           main] w.s.c.ServletWebServerApplicationContext : Root WebApplicationContext: initialization completed in 2848 ms
Standard Commons Logging discovery in action with spring-jcl: please remove commons-logging.jar from classpath in order to avoid potential conflicts
Mockito is currently self-attaching to enable the inline-mock-maker. This will no longer work in future releases of the JDK. Please add Mockito as an agent to your build what is described in Mockito's documentation: https://javadoc.io/doc/org.mockito/mockito-core/latest/org/mockito/Mockito.html#0.3
WARNING: A Java agent has been loaded dynamically (/Users/Jefferson/.m2/repository/net/bytebuddy/byte-buddy-agent/1.15.11/byte-buddy-agent-1.15.11.jar)
WARNING: If a serviceability tool is in use, please run with -XX:+EnableDynamicAgentLoading to hide this warning
WARNING: If a serviceability tool is not in use, please run with -Djdk.instrument.traceUsage for more information
WARNING: Dynamic loading of agents will be disallowed by default in a future release
OpenJDK 64-Bit Server VM warning: Sharing is only supported for boot loader classes because bootstrap classpath has been appended
2025-11-26T23:54:24.691+01:00  INFO 2986 --- [invoices-monolith-test] [           main] c.invoices.security.RateLimitingFilter   : Rate limiting filter initialized with limits: General=100/1 min, Auth=10/1 min
2025-11-26T23:54:25.199+01:00  INFO 2986 --- [invoices-monolith-test] [           main] o.hibernate.jpa.internal.util.LogHelper  : HHH000204: Processing PersistenceUnitInfo [name: default]
2025-11-26T23:54:25.343+01:00  INFO 2986 --- [invoices-monolith-test] [           main] org.hibernate.Version                    : HHH000412: Hibernate ORM core version 6.6.11.Final
2025-11-26T23:54:25.432+01:00  INFO 2986 --- [invoices-monolith-test] [           main] o.h.c.internal.RegionFactoryInitiator    : HHH000026: Second-level cache disabled
2025-11-26T23:54:25.729+01:00  INFO 2986 --- [invoices-monolith-test] [           main] o.s.o.j.p.SpringPersistenceUnitInfo      : No LoadTimeWeaver setup: ignoring JPA class transformer
2025-11-26T23:54:25.807+01:00  INFO 2986 --- [invoices-monolith-test] [           main] com.zaxxer.hikari.HikariDataSource       : HikariPool-1 - Starting...
2025-11-26T23:54:26.451+01:00  INFO 2986 --- [invoices-monolith-test] [           main] com.zaxxer.hikari.pool.HikariPool        : HikariPool-1 - Added connection conn0: url=jdbc:h2:mem:testdb user=SA
2025-11-26T23:54:26.453+01:00  INFO 2986 --- [invoices-monolith-test] [           main] com.zaxxer.hikari.HikariDataSource       : HikariPool-1 - Start completed.
2025-11-26T23:54:26.496+01:00  WARN 2986 --- [invoices-monolith-test] [           main] org.hibernate.orm.deprecation            : HHH90000025: H2Dialect does not need to be specified explicitly using 'hibernate.dialect' (remove the property setting and it will be selected by default)
2025-11-26T23:54:26.528+01:00  INFO 2986 --- [invoices-monolith-test] [           main] org.hibernate.orm.connections.pooling    : HHH10001005: Database info:
	Database JDBC URL [Connecting through datasource 'HikariDataSource (HikariPool-1)']
	Database driver: undefined/unknown
	Database version: 2.3.232
	Autocommit mode: undefined/unknown
	Isolation level: undefined/unknown
	Minimum pool size: undefined/unknown
	Maximum pool size: undefined/unknown
2025-11-26T23:54:28.436+01:00  INFO 2986 --- [invoices-monolith-test] [           main] o.h.e.t.j.p.i.JtaPlatformInitiator       : HHH000489: No JTA platform available (set 'hibernate.transaction.jta.platform' to enable JTA platform integration)
2025-11-26T23:54:28.528+01:00  INFO 2986 --- [invoices-monolith-test] [           main] j.LocalContainerEntityManagerFactoryBean : Initialized JPA EntityManagerFactory for persistence unit 'default'
2025-11-26T23:54:29.526+01:00  INFO 2986 --- [invoices-monolith-test] [           main] o.s.d.j.r.query.QueryEnhancerFactory     : Hibernate is in classpath; If applicable, HQL parser will be used.
2025-11-26T23:54:32.159+01:00  INFO 2986 --- [invoices-monolith-test] [           main] c.i.i.i.config.TaxRatesService           : Loaded IVA rate: Superreducido - 4.0%
2025-11-26T23:54:32.159+01:00  INFO 2986 --- [invoices-monolith-test] [           main] c.i.i.i.config.TaxRatesService           : Loaded IVA rate: Reducido - 10.0%
2025-11-26T23:54:32.160+01:00  INFO 2986 --- [invoices-monolith-test] [           main] c.i.i.i.config.TaxRatesService           : Loaded IVA rate: General - 21.0%
2025-11-26T23:54:32.160+01:00  INFO 2986 --- [invoices-monolith-test] [           main] c.i.i.i.config.TaxRatesService           : Loaded RE: IVA 21.0% -> RE 5.2%
2025-11-26T23:54:32.160+01:00  INFO 2986 --- [invoices-monolith-test] [           main] c.i.i.i.config.TaxRatesService           : Loaded RE: IVA 10.0% -> RE 1.4%
2025-11-26T23:54:32.160+01:00  INFO 2986 --- [invoices-monolith-test] [           main] c.i.i.i.config.TaxRatesService           : Loaded RE: IVA 4.0% -> RE 0.5%
2025-11-26T23:54:32.160+01:00  INFO 2986 --- [invoices-monolith-test] [           main] c.i.i.i.config.TaxRatesService           : Loaded IRPF rate: Retención profesional estándar - 15.0%
2025-11-26T23:54:32.160+01:00  INFO 2986 --- [invoices-monolith-test] [           main] c.i.i.i.config.TaxRatesService           : Loaded IRPF rate: Retención reducida (nuevos autónomos) - 7.0%
2025-11-26T23:54:32.160+01:00  INFO 2986 --- [invoices-monolith-test] [           main] c.i.i.i.config.TaxRatesService           : Loaded IRPF rate: Sin retención / exento - 0.0%
2025-11-26T23:54:32.160+01:00  INFO 2986 --- [invoices-monolith-test] [           main] c.i.i.i.config.TaxRatesService           : Tax rates loaded successfully from tax_rates_2025.json
2025-11-26T23:54:33.109+01:00  INFO 2986 --- [invoices-monolith-test] [           main] o.s.ws.soap.saaj.SaajSoapMessageFactory  : Creating SAAJ 1.3 MessageFactory with SOAP 1.1 Protocol
2025-11-26T23:54:33.163+01:00  WARN 2986 --- [invoices-monolith-test] [           main] o.s.aop.framework.CglibAopProxy          : Unable to proxy interface-implementing method [public final void org.springframework.ws.client.core.support.WebServiceGatewaySupport.afterPropertiesSet() throws java.lang.Exception] because it is marked as final, consider using interface-based JDK proxies instead.
2025-11-26T23:54:33.967+01:00  WARN 2986 --- [invoices-monolith-test] [           main] JpaBaseConfiguration$JpaWebConfiguration : spring.jpa.open-in-view is enabled by default. Therefore, database queries may be performed during view rendering. Explicitly configure spring.jpa.open-in-view to disable this warning
2025-11-26T23:54:34.210+01:00  WARN 2986 --- [invoices-monolith-test] [           main] r$InitializeUserDetailsManagerConfigurer : Global AuthenticationManager configured with an AuthenticationProvider bean. UserDetailsService beans will not be used by Spring Security for automatically configuring username/password login. Consider removing the AuthenticationProvider bean. Alternatively, consider using the UserDetailsService in a manually instantiated DaoAuthenticationProvider. If the current configuration is intentional, to turn off this warning, increase the logging level of 'org.springframework.security.config.annotation.authentication.configuration.InitializeUserDetailsBeanManagerConfigurer' to ERROR
2025-11-26T23:54:34.333+01:00  INFO 2986 --- [invoices-monolith-test] [           main] com.invoices.config.CorsConfig           : Configuring CORS for origins: *
2025-11-26T23:54:34.333+01:00  INFO 2986 --- [invoices-monolith-test] [           main] com.invoices.config.CorsConfig           : CORS configured successfully - Allow credentials: true, Max age: 3600s
2025-11-26T23:54:34.913+01:00  INFO 2986 --- [invoices-monolith-test] [           main] o.s.b.a.e.web.EndpointLinksResolver      : Exposing 2 endpoints beneath base path '/actuator'
2025-11-26T23:54:34.963+01:00  INFO 2986 --- [invoices-monolith-test] [           main] com.invoices.security.SecurityConfig     : Configuring security filter chain
2025-11-26T23:54:34.964+01:00  INFO 2986 --- [invoices-monolith-test] [           main] com.invoices.security.SecurityConfig     : Configuring CORS in Spring Security for origin patterns: *
2025-11-26T23:54:34.964+01:00  INFO 2986 --- [invoices-monolith-test] [           main] com.invoices.security.SecurityConfig     : CORS configured - Allow credentials: true, Methods: *
2025-11-26T23:54:35.002+01:00  INFO 2986 --- [invoices-monolith-test] [           main] com.invoices.security.SecurityConfig     : Security filter chain configured successfully
2025-11-26T23:54:36.290+01:00  INFO 2986 --- [invoices-monolith-test] [           main] .w.s.a.s.AnnotationActionEndpointMapping : Supporting [WS-Addressing August 2004, WS-Addressing 1.0]
2025-11-26T23:54:36.403+01:00  INFO 2986 --- [invoices-monolith-test] [           main] o.s.m.s.b.SimpleBrokerMessageHandler     : Starting...
2025-11-26T23:54:36.403+01:00  INFO 2986 --- [invoices-monolith-test] [           main] o.s.m.s.b.SimpleBrokerMessageHandler     : BrokerAvailabilityEvent[available=true, SimpleBrokerMessageHandler [org.springframework.messaging.simp.broker.DefaultSubscriptionRegistry@1dfd8f40]]
2025-11-26T23:54:36.404+01:00  INFO 2986 --- [invoices-monolith-test] [           main] o.s.m.s.b.SimpleBrokerMessageHandler     : Started.
2025-11-26T23:54:36.475+01:00  INFO 2986 --- [invoices-monolith-test] [           main] o.s.b.w.embedded.tomcat.TomcatWebServer  : Tomcat started on port 8080 (http) with context path '/'
2025-11-26T23:54:36.491+01:00  INFO 2986 --- [invoices-monolith-test] [           main] c.i.i.i.messaging.RedisEventListenerIT   : Started RedisEventListenerIT in 16.592 seconds (process running for 17.938)
2025-11-26T23:54:36.500+01:00 ERROR 2986 --- [invoices-monolith-test] [MessageBroker-1] c.i.i.i.messaging.VerifactuConsumer      : [VeriFactu Consumer] Error consuming messages

java.lang.NullPointerException: Cannot invoke "org.springframework.data.redis.core.StreamOperations.read(org.springframework.data.redis.connection.stream.Consumer, org.springframework.data.redis.connection.stream.StreamOffset[])" because the return value of "org.springframework.data.redis.core.RedisTemplate.opsForStream()" is null
	at com.invoices.invoice.infrastructure.messaging.VerifactuConsumer.consumeInvoices(VerifactuConsumer.java:65) ~[classes/:na]
	at java.base/jdk.internal.reflect.DirectMethodHandleAccessor.invoke(DirectMethodHandleAccessor.java:103) ~[na:na]
	at java.base/java.lang.reflect.Method.invoke(Method.java:580) ~[na:na]
	at org.springframework.aop.support.AopUtils.invokeJoinpointUsingReflection(AopUtils.java:359) ~[spring-aop-6.2.5.jar:6.2.5]
	at org.springframework.aop.framework.ReflectiveMethodInvocation.invokeJoinpoint(ReflectiveMethodInvocation.java:196) ~[spring-aop-6.2.5.jar:6.2.5]
	at org.springframework.aop.framework.ReflectiveMethodInvocation.proceed(ReflectiveMethodInvocation.java:163) ~[spring-aop-6.2.5.jar:6.2.5]
	at org.springframework.aop.framework.adapter.MethodBeforeAdviceInterceptor.invoke(MethodBeforeAdviceInterceptor.java:58) ~[spring-aop-6.2.5.jar:6.2.5]
	at org.springframework.aop.framework.ReflectiveMethodInvocation.proceed(ReflectiveMethodInvocation.java:184) ~[spring-aop-6.2.5.jar:6.2.5]
	at org.springframework.aop.interceptor.ExposeInvocationInterceptor.invoke(ExposeInvocationInterceptor.java:97) ~[spring-aop-6.2.5.jar:6.2.5]
	at org.springframework.aop.framework.ReflectiveMethodInvocation.proceed(ReflectiveMethodInvocation.java:184) ~[spring-aop-6.2.5.jar:6.2.5]
	at org.springframework.aop.framework.CglibAopProxy$DynamicAdvisedInterceptor.intercept(CglibAopProxy.java:727) ~[spring-aop-6.2.5.jar:6.2.5]
	at com.invoices.invoice.infrastructure.messaging.VerifactuConsumer$$SpringCGLIB$$0.consumeInvoices(<generated>) ~[classes/:na]
	at java.base/jdk.internal.reflect.DirectMethodHandleAccessor.invoke(DirectMethodHandleAccessor.java:103) ~[na:na]
	at java.base/java.lang.reflect.Method.invoke(Method.java:580) ~[na:na]
	at org.springframework.scheduling.support.ScheduledMethodRunnable.runInternal(ScheduledMethodRunnable.java:130) ~[spring-context-6.2.5.jar:6.2.5]
	at org.springframework.scheduling.support.ScheduledMethodRunnable.lambda$run$2(ScheduledMethodRunnable.java:124) ~[spring-context-6.2.5.jar:6.2.5]
	at io.micrometer.observation.Observation.observe(Observation.java:498) ~[micrometer-observation-1.14.5.jar:1.14.5]
	at org.springframework.scheduling.support.ScheduledMethodRunnable.run(ScheduledMethodRunnable.java:124) ~[spring-context-6.2.5.jar:6.2.5]
	at org.springframework.scheduling.config.Task$OutcomeTrackingRunnable.run(Task.java:85) ~[spring-context-6.2.5.jar:6.2.5]
	at org.springframework.scheduling.support.DelegatingErrorHandlingRunnable.run(DelegatingErrorHandlingRunnable.java:54) ~[spring-context-6.2.5.jar:6.2.5]
	at java.base/java.util.concurrent.Executors$RunnableAdapter.call(Executors.java:572) ~[na:na]
	at java.base/java.util.concurrent.FutureTask.runAndReset(FutureTask.java:358) ~[na:na]
	at java.base/java.util.concurrent.ScheduledThreadPoolExecutor$ScheduledFutureTask.run(ScheduledThreadPoolExecutor.java:305) ~[na:na]
	at java.base/java.util.concurrent.ThreadPoolExecutor.runWorker(ThreadPoolExecutor.java:1144) ~[na:na]
	at java.base/java.util.concurrent.ThreadPoolExecutor$Worker.run(ThreadPoolExecutor.java:642) ~[na:na]
	at java.base/java.lang.Thread.run(Thread.java:1583) ~[na:na]

2025-11-26T23:54:36.707+01:00  INFO 2986 --- [invoices-monolith-test] [nio-8080-exec-1] o.a.c.c.C.[Tomcat].[localhost].[/]       : Initializing Spring DispatcherServlet 'dispatcherServlet'
2025-11-26T23:54:36.707+01:00  INFO 2986 --- [invoices-monolith-test] [nio-8080-exec-1] o.s.web.servlet.DispatcherServlet        : Initializing Servlet 'dispatcherServlet'
2025-11-26T23:54:36.709+01:00  INFO 2986 --- [invoices-monolith-test] [nio-8080-exec-1] o.s.web.servlet.DispatcherServlet        : Completed initialization in 2 ms
[ERROR] Tests run: 1, Failures: 0, Errors: 1, Skipped: 0, Time elapsed: 17.42 s <<< FAILURE! -- in com.invoices.invoice.infrastructure.messaging.RedisEventListenerIT
[ERROR] com.invoices.invoice.infrastructure.messaging.RedisEventListenerIT.shouldReceiveWebSocketMessageWhenRedisEventIsPublished -- Time elapsed: 0.192 s <<< ERROR!
java.util.concurrent.ExecutionException: jakarta.websocket.DeploymentException: The HTTP response from the server [200] did not permit the HTTP upgrade to WebSocket
	at java.base/java.util.concurrent.CompletableFuture.reportGet(CompletableFuture.java:396)
	at java.base/java.util.concurrent.CompletableFuture.get(CompletableFuture.java:2096)
	at com.invoices.invoice.infrastructure.messaging.RedisEventListenerIT.shouldReceiveWebSocketMessageWhenRedisEventIsPublished(RedisEventListenerIT.java:67)
	at java.base/java.lang.reflect.Method.invoke(Method.java:580)
	at java.base/java.util.ArrayList.forEach(ArrayList.java:1596)
	at java.base/java.util.ArrayList.forEach(ArrayList.java:1596)
Caused by: jakarta.websocket.DeploymentException: The HTTP response from the server [200] did not permit the HTTP upgrade to WebSocket
	at org.apache.tomcat.websocket.WsWebSocketContainer.connectToServerRecursive(WsWebSocketContainer.java:384)
	at org.apache.tomcat.websocket.WsWebSocketContainer.connectToServer(WsWebSocketContainer.java:179)
	at org.springframework.web.socket.client.standard.StandardWebSocketClient.lambda$executeInternal$0(StandardWebSocketClient.java:175)
	at org.springframework.util.concurrent.FutureUtils.lambda$toSupplier$0(FutureUtils.java:74)
	at java.base/java.util.concurrent.CompletableFuture$AsyncSupply.run(CompletableFuture.java:1768)
	at java.base/java.lang.Thread.run(Thread.java:1583)

[INFO] 
[INFO] Results:
[INFO] 
[ERROR] Errors: 
[ERROR]   RedisEventListenerIT.shouldReceiveWebSocketMessageWhenRedisEventIsPublished:67 » Execution jakarta.websocket.DeploymentException: The HTTP response from the server [200] did not permit the HTTP upgrade to WebSocket
[INFO] 
[ERROR] Tests run: 1, Failures: 0, Errors: 1, Skipped: 0
[INFO] 
[INFO] ------------------------------------------------------------------------
[INFO] BUILD FAILURE
[INFO] ------------------------------------------------------------------------
[INFO] Total time:  20.853 s
[INFO] Finished at: 2025-11-26T23:54:37+01:00
[INFO] ------------------------------------------------------------------------
[ERROR] Failed to execute goal org.apache.maven.plugins:maven-surefire-plugin:3.2.5:test (default-test) on project invoices-monolith: 
[ERROR] 
[ERROR] Please refer to /Users/Jefferson/Documents/proyecto/invoices-back/invoices-monolith/target/surefire-reports for the individual test results.
[ERROR] Please refer to dump files (if any exist) [date].dump, [date]-jvmRun[N].dump and [date].dumpstream.
[ERROR] -> [Help 1]
[ERROR] 
[ERROR] To see the full stack trace of the errors, re-run Maven with the -e switch.
[ERROR] Re-run Maven using the -X switch to enable full debug logging.
[ERROR] 
[ERROR] For more information about the errors and possible solutions, please read the following articles:
[ERROR] [Help 1] http://cwiki.apache.org/confluence/display/MAVEN/MojoFailureException
